{
  "$schema": "../../../../schemas/lab.schema.json",
  "id": "delta-lakehouse-time-travel",
  "title": "Delta Lakehouse: Transacciones ACID, MERGE y Time Travel",
  "goal": "Crear una tabla Delta localmente utilizando Python y deltalake, ejecutar operaciones ACID de inserción y MERGE condicional (Upsert), simular un borrado corruptor accidental y restaurar los datos a la versión previa mediante la funcionalidad de Time Travel.",
  "level": "intermediate",
  "estimatedMinutes": 45,
  "icon": "shield",
  "domainId": "distributed-systems-bigdata",
  "lessonId": "data-lakes-lakehouses-acid",
  "file": "delta_acid_time_travel.py",
  "steps": [
    "Crear una tabla Delta inicial con 3 usuarios (id, name, balance).",
    "Ejecutar una actualización transaccional usando MERGE (Upsert): actualizar el balance de un usuario existente e insertar un usuario nuevo de forma atómica.",
    "Simular un error operativo destructivo (DELETE accidental de todas las filas).",
    "Consultar el Transaction Log de Delta (_delta_log/) para auditar el historial de versiones (versión 0, versión 1, versión 2).",
    "Recuperar los datos a la versión 1 anterior al desastre utilizando Time Travel (as_version=1) y validar la integridad recuperada."
  ],
  "code": "import shutil\nimport os\nimport pandas as pd\nfrom deltalake import DeltaTable, write_deltalake\n\ntable_path = \"./delta_users_table\"\nif os.path.exists(table_path):\n    shutil.rmtree(table_path)\n\n# 1. Version 0: Creacion de la tabla Delta\ndf_v0 = pd.DataFrame([\n    {\"id\": 1, \"name\": \"Ana\", \"balance\": 1000.0},\n    {\"id\": 2, \"name\": \"Bob\", \"balance\": 2500.0},\n    {\"id\": 3, \"name\": \"Clara\", \"balance\": 3200.0}\n])\nwrite_deltalake(table_path, df_v0, mode=\"overwrite\")\nprint(\"Version 0 creada exitosamente con 3 registros.\")\n\n# 2. Version 1: Operacion MERGE / Upsert condicional\ndt = DeltaTable(table_path)\ndf_updates = pd.DataFrame([\n    {\"id\": 2, \"name\": \"Bob\", \"balance\": 3000.0},  # Update: nuevo balance\n    {\"id\": 4, \"name\": \"David\", \"balance\": 1500.0}  # Insert: nuevo usuario\n])\n\ndt.merge(\n    source=df_updates,\n    predicate=\"target.id = source.id\",\n    source_alias=\"source\",\n    target_alias=\"target\"\n).when_matched_update_all().when_not_matched_insert_all().execute()\nprint(\"Version 1 (MERGE Upsert) completada.\")\n\n# 3. Version 2: Incidente destructivo (Delete total accidental)\ndt.delete()\nprint(\"Version 2 ejecutada: ¡Tabla vaciada por error operativo!\")\nprint(f\"Filas actuales en la tabla: {len(DeltaTable(table_path).to_pandas())}\")\n\n# 4. Auditoria del Transaction Log\ndt = DeltaTable(table_path)\nprint(f\"\\nVersion actual del Delta Log: {dt.version()}\")\n\n# 5. Time Travel: Restaurar a la Version 1\ndt_restored = DeltaTable(table_path, version=1)\ndf_recovered = dt_restored.to_pandas()\nprint(\"\\n--- DATOS RECUPERADOS CON TIME TRAVEL (Version 1) ---\")\nprint(df_recovered.to_string(index=False))\n\n# Limpieza\nshutil.rmtree(table_path)\n",
  "codeLanguage": "python",
  "expectedOutput": "Version 0 creada exitosamente con 3 registros.\nVersion 1 (MERGE Upsert) completada.\nVersion 2 ejecutada: ¡Tabla vaciada por error operativo!\nFilas actuales en la tabla: 0\n\nVersion actual del Delta Log: 2\n\n--- DATOS RECUPERADOS CON TIME TRAVEL (Version 1) ---\n id  name  balance\n  1   Ana   1000.0\n  3 Clara   3200.0\n  2   Bob   3000.0\n  4 David   1500.0",
  "verify": "El motor de Delta Lake registra cada operación en un commit JSON atómico en _delta_log, permitiendo revertir el DELETE destructivo y consultar el estado previo de forma instantánea.",
  "successCriteria": [
    "La operación MERGE actualiza el registro con id=2 e inserta el id=4 en una sola transacción atómica.",
    "El Delta Log incrementa el número de versión formal tras cada commit.",
    "La consulta con version=1 restaura intactas las 4 tuplas antes del DELETE accidental.",
    "No se pierde información debido a la inmutabilidad de los archivos Parquet subyacentes."
  ]
}
