{
  "$schema": "../../../../schemas/lab.schema.json",
  "id": "lab-scd-type-2-pipeline",
  "title": "Implementación de Dimensión SCD Tipo 2 Idempotente",
  "goal": "Construir un script en Python/SQLite que detecte cambios en clientes y aplique la lógica de SCD Tipo 2: cerrar la versión previa con valid_to e insertar la versión nueva con is_current=TRUE.",
  "level": "intermediate",
  "estimatedMinutes": 15,
  "icon": "layers",
  "domainId": "relational-modeling-sql-dwh",
  "lessonId": "dimensiones-cambio-lento-scd2",
  "file": "lab02_scd2.py",
  "steps": [
    "Crea la tabla dim_cliente con cliente_sk, cliente_id, ciudad, valid_from, valid_to e is_current.",
    "Inserta el registro inicial de Juan en Madrid con vigencia 2026-01-01.",
    "Simula un cambio de residencia a Barcelona el 2026-06-01 actualizando la versión previa e insertando la nueva.",
    "Verifica que consultar Juan en febrero devuelve Madrid y en julio devuelve Barcelona."
  ],
  "code": "import sqlite3\n\nconn = sqlite3.connect(':memory:')\ncur = conn.cursor()\n\ncur.execute('''\nCREATE TABLE dim_cliente (\n    cliente_sk INTEGER PRIMARY KEY AUTOINCREMENT,\n    cliente_id INTEGER,\n    nombre TEXT,\n    ciudad TEXT,\n    valid_from TEXT,\n    valid_to TEXT,\n    is_current INTEGER\n);\n''')\n\n# Registro inicial Version 1\ncur.execute('''\nINSERT INTO dim_cliente (cliente_id, nombre, ciudad, valid_from, valid_to, is_current)\nVALUES (101, 'Juan Perez', 'Madrid', '2026-01-01', '9999-12-31', 1);\n''')\n\n# Mudanza a Barcelona en 2026-06-01 (Lógica SCD2)\ncur.execute('''\nUPDATE dim_cliente\nSET valid_to = '2026-05-31', is_current = 0\nWHERE cliente_id = 101 AND is_current = 1;\n''')\n\ncur.execute('''\nINSERT INTO dim_cliente (cliente_id, nombre, ciudad, valid_from, valid_to, is_current)\nVALUES (101, 'Juan Perez', 'Barcelona', '2026-06-01', '9999-12-31', 1);\n''')\n\ncur.execute('SELECT cliente_sk, ciudad, valid_from, valid_to, is_current FROM dim_cliente;')\nfor row in cur.fetchall():\n    print(f'SK: {row[0]} | Ciudad: {row[1]:10} | Vigencia: {row[2]} a {row[3]} | Actual: {bool(row[4])}')\n",
  "codeLanguage": "python",
  "expectedOutput": "SK: 1 | Ciudad: Madrid     | Vigencia: 2026-01-01 a 2026-05-31 | Actual: False\nSK: 2 | Ciudad: Barcelona  | Vigencia: 2026-06-01 a 9999-12-31 | Actual: True",
  "verify": "La base contiene dos registros para el cliente 101: la versión 1 cerrada y la versión 2 vigente.",
  "successCriteria": [
    "Se conserva la fila histórica sin pérdida de información.",
    "La versión antigua tiene is_current=0 y fecha de fin correcta.",
    "La versión nueva tiene is_current=1 y fecha de fin abierta (9999-12-31)."
  ]
}