{
  "$schema": "../../../../schemas/lab.schema.json",
  "id": "star-schema-scd-type-2",
  "title": "Modelado Dimensional: Esquema en Estrella y SCD Tipo 2",
  "goal": "Diseñar e implementar en SQL un Esquema en Estrella para el dominio de viajes, implementando la dimensión de clientes con Slowly Changing Dimension Tipo 2 (SCD2) para registrar históricamente los cambios de residencia y vincular transacciones con la versión dimensional correcta.",
  "level": "advanced",
  "estimatedMinutes": 45,
  "icon": "star",
  "domainId": "relational-modeling-olap",
  "lessonId": "modelado-dimensional-dwh",
  "file": "star_schema_scd2.sql",
  "steps": [
    "Crear la dimensión dim_passenger_scd2 con surrogate key passenger_sk, natural key passenger_id, name, city, valid_from, valid_to, is_current.",
    "Crear la tabla de hechos fact_trips con trip_id, passenger_sk, driver_id, trip_date, fare_amount.",
    "Insertar el registro inicial del pasajero 101 viviendo en 'Bogota' a partir de 2026-01-01.",
    "Registrar un viaje en Bogotá asociado a la versión activa del pasajero.",
    "Simular la mudanza del pasajero 101 a 'Madrid' en 2026-06-01: cerrar la vigencia de la versión previa e insertar la nueva fila.",
    "Registrar un segundo viaje en Madrid y validar que ambos viajes apuntan a sus respectivas claves subrogadas históricas correctas."
  ],
  "code": "-- 1. Creacion de la Dimension SCD Tipo 2\nDROP TABLE IF EXISTS fact_trips;\nDROP TABLE IF EXISTS dim_passenger_scd2;\n\nCREATE TABLE dim_passenger_scd2 (\n    passenger_sk SERIAL PRIMARY KEY,\n    passenger_id INT NOT NULL,\n    name VARCHAR(100) NOT NULL,\n    city VARCHAR(100) NOT NULL,\n    valid_from TIMESTAMP NOT NULL,\n    valid_to TIMESTAMP NOT NULL DEFAULT '9999-12-31 23:59:59',\n    is_current BOOLEAN NOT NULL DEFAULT TRUE\n);\n\n-- 2. Creacion de la Tabla de Hechos\nCREATE TABLE fact_trips (\n    trip_id SERIAL PRIMARY KEY,\n    passenger_sk INT NOT NULL REFERENCES dim_passenger_scd2(passenger_sk),\n    driver_id INT NOT NULL,\n    trip_date TIMESTAMP NOT NULL,\n    fare_amount NUMERIC(10,2) NOT NULL\n);\n\n-- 3. Estado inicial: Pasajero 101 en Bogota\nINSERT INTO dim_passenger_scd2 (passenger_id, name, city, valid_from, is_current) \nVALUES (101, 'Carlos Perez', 'Bogota', '2026-01-01 00:00:00', TRUE);\n\n-- Viaje 1 realizado en Bogota en Febrero\nINSERT INTO fact_trips (passenger_sk, driver_id, trip_date, fare_amount)\nSELECT passenger_sk, 450, '2026-02-15 14:30:00', 25.50\nFROM dim_passenger_scd2 WHERE passenger_id = 101 AND is_current = TRUE;\n\n-- 4. Modificacion SCD2: El pasajero se muda a Madrid el 1 de Junio\n-- Paso A: Cerrar registro anterior\nUPDATE dim_passenger_scd2 \nSET valid_to = '2026-06-01 00:00:00', is_current = FALSE\nWHERE passenger_id = 101 AND is_current = TRUE;\n\n-- Paso B: Insertar nueva version activa\nINSERT INTO dim_passenger_scd2 (passenger_id, name, city, valid_from, is_current)\nVALUES (101, 'Carlos Perez', 'Madrid', '2026-06-01 00:00:00', TRUE);\n\n-- Viaje 2 realizado en Madrid en Julio\nINSERT INTO fact_trips (passenger_sk, driver_id, trip_date, fare_amount)\nSELECT passenger_sk, 920, '2026-07-10 18:00:00', 45.00\nFROM dim_passenger_scd2 WHERE passenger_id = 101 AND is_current = TRUE;\n\n-- 5. Consulta de auditoria historica\nSELECT \n    f.trip_id,\n    d.passenger_id,\n    d.name,\n    d.city AS ciudad_en_momento_del_viaje,\n    f.trip_date,\n    f.fare_amount\nFROM fact_trips f\nJOIN dim_passenger_scd2 d ON f.passenger_sk = d.passenger_sk\nORDER BY f.trip_date;\n",
  "codeLanguage": "sql",
  "expectedOutput": "trip_id | passenger_id |    name     | ciudad_en_momento_del_viaje |      trip_date      | fare_amount\n--------+--------------+-------------+-----------------------------+---------------------+-------------\n      1 |          101 | Carlos Perez| Bogota                      | 2026-02-15 14:30:00 |       25.50\n      2 |          101 | Carlos Perez| Madrid                      | 2026-07-10 18:00:00 |       45.00",
  "verify": "La consulta de la tabla de hechos con la dimensión muestra con fidelidad que el viaje 1 se imputa a Bogotá y el viaje 2 a Madrid sin modificar la clave de negocio del usuario.",
  "successCriteria": [
    "dim_passenger_scd2 contiene exactamente dos registros para el pasajero 101 con distintos passenger_sk.",
    "El registro de Bogotá tiene is_current=FALSE y valid_to='2026-06-01 00:00:00'.",
    "El registro de Madrid tiene is_current=TRUE y valid_to='9999-12-31 23:59:59'.",
    "Cada viaje en fact_trips apunta a la clave subrogada correspondiente a su fecha de ocurrencia."
  ]
}
