{
  "$schema": "../../../../schemas/lab.schema.json",
  "id": "external-merge-sort",
  "title": "Implementación de External Merge Sort",
  "goal": "Implementar un algoritmo de External Merge Sort en Python para demostrar cómo ordenar un conjunto de datos que excede el límite de memoria RAM disponible, dividiendo en bloques ordenados (runs) y mezclándolos mediante streaming con una cola de prioridad (min-heap).",
  "level": "intermediate",
  "estimatedMinutes": 45,
  "icon": "chart",
  "domainId": "cs-fundamentals-os",
  "lessonId": "algoritmos-complejidad-big-o",
  "file": "external_merge_sort.py",
  "steps": [
    "Crear un archivo de prueba con 10,000 números enteros aleatorios desordenados en disco.",
    "Fase 1 (Split & Sort): Leer el archivo en fragmentos fijos (runs) de 2,000 elementos (simulando el límite estricto de RAM), ordenar cada bloque en memoria y volcarlo a un archivo temporal.",
    "Fase 2 (K-Way Merge): Abrir simultáneamente descriptores para cada run temporal y usar heapq (min-heap) para extraer el elemento menor en cada paso.",
    "Escribir secuencialmente el flujo ordenado resultante en el archivo final.",
    "Eliminar los archivos temporales y verificar que la lista final está estrictamente ordenada."
  ],
  "code": "import heapq\nimport os\nimport random\nimport tempfile\n\nCHUNK_SIZE = 2000  # Limite simulado de capacidad en RAM\nTOTAL_ITEMS = 10000\n\ndef crear_datos_desordenados(ruta):\n    with open(ruta, \"w\") as f:\n        for _ in range(TOTAL_ITEMS):\n            f.write(f\"{random.randint(1, 1000000)}\\n\")\n\ndef external_merge_sort(archivo_origen, archivo_destino):\n    temp_files = []\n    \n    # FASE 1: Dividir en bloques (runs) y ordenar en RAM\n    with open(archivo_origen, \"r\") as f:\n        while True:\n            lineas = [int(f.readline()) for _ in range(CHUNK_SIZE) if True]\n            lineas = [x for x in lineas if x is not None] # limpiar vacios\n            # Si llegamos al final del archivo\n            lineas_reales = []\n            f.seek(f.tell())\n            chunk = []\n            for _ in range(CHUNK_SIZE):\n                line = f.readline()\n                if not line: break\n                chunk.append(int(line.strip()))\n            if not chunk:\n                break\n            chunk.sort()\n            temp = tempfile.NamedTemporaryFile(mode=\"w+\", delete=False)\n            for num in chunk:\n                temp.write(f\"{num}\\n\")\n            temp.flush()\n            temp.seek(0)\n            temp_files.append(temp)\n\n    # FASE 2: K-Way Merge con Min-Heap\n    heap = []\n    for idx, tf in enumerate(temp_files):\n        line = tf.readline()\n        if line:\n            heapq.heappush(heap, (int(line.strip()), idx))\n            \n    with open(archivo_destino, \"w\") as out:\n        while heap:\n            val, file_idx = heapq.heappop(heap)\n            out.write(f\"{val}\\n\")\n            next_line = temp_files[file_idx].readline()\n            if next_line:\n                heapq.heappush(heap, (int(next_line.strip()), file_idx))\n                \n    # Limpieza de archivos temporales\n    for tf in temp_files:\n        tf.close()\n        os.unlink(tf.name)\n\n# Ejecucion y verificacion\ninput_p = \"dataset_raw.txt\"\noutput_p = \"dataset_sorted.txt\"\ncrear_datos_desordenados(input_p)\nexternal_merge_sort(input_p, output_p)\n\n# Validar orden\nwith open(output_p) as f:\n    datos = [int(line.strip()) for line in f]\nis_sorted = all(datos[i] <= datos[i+1] for i in range(len(datos)-1))\nprint(f\"Total elementos procesados: {len(datos)}\")\nprint(f\"¿El dataset final esta correctamente ordenado?: {is_sorted}\")\n\nos.remove(input_p)\nos.remove(output_p)\n",
  "codeLanguage": "python",
  "expectedOutput": "Total elementos procesados: 10000\n¿El dataset final esta correctamente ordenado?: True",
  "verify": "El script simula un entorno donde el dataset es varias veces mayor que el buffer de memoria disponible, completando la ordenación mediante external runs y min-heap de manera exitosa.",
  "successCriteria": [
    "La fase de particionado genera exactamente los archivos temporales correspondientes al CHUNK_SIZE.",
    "El algoritmo utiliza heapq para mezclar los punteros de los archivos en O(log K) por elemento.",
    "El archivo de salida final contiene la totalidad de los registros ordenados ascendentemente.",
    "Los archivos temporales se limpian correctamente al finalizar la ejecución."
  ]
}
