{
  "$schema": "../../../../schemas/lab.schema.json",
  "id": "bash-stream-processing-awk",
  "title": "Procesamiento de Flujos en Linux con Awk y Pipes",
  "goal": "Escribir un script Bash que procese un flujo masivo de registros simulando un archivo de varios gigabytes, usando awk y tuberías Unix para filtrar errores HTTP y calcular agregaciones en tiempo real sin cargar el archivo en la memoria RAM.",
  "level": "intermediate",
  "estimatedMinutes": 35,
  "icon": "terminal",
  "domainId": "cs-fundamentals-os",
  "lessonId": "arquitectura-computadores-linux",
  "file": "stream_processor.sh",
  "steps": [
    "Generar un flujo sintético de registros de log simulando 1,000,000 de líneas con formato: TIMESTAMP IP METODO URL STATUS_CODE LATENCY.",
    "Conectar el generador a través de una tubería (|) directamente a un filtro awk.",
    "Filtrar únicamente las peticiones con códigos de error 5xx (500 a 599).",
    "Calcular el conteo total de errores, la latencia promedio y agrupar por código de error en la sección END de awk.",
    "Monitorear el consumo de memoria del proceso asegurando que nunca sobrepase 10MB de RAM."
  ],
  "code": "#!/usr/bin/env bash\nset -euo pipefail\n\n# Simulador de generador de logs masivos por streaming\ngenerate_logs() {\n    python3 -c '\nimport random, time\nstatuses = [200, 200, 200, 201, 400, 404, 500, 502, 503]\nfor i in range(500000):\n    status = random.choice(statuses)\n    latency = round(random.uniform(5.0, 850.0), 2)\n    print(f\"2026-09-28T12:00:00Z 192.168.1.{i%255} GET /api/v1/resource {status} {latency}\")\n'\n}\n\necho \"Iniciando procesamiento por streaming sin almacenamiento intermedio en disco...\"\ngenerate_logs | awk '\n    # Condicion de filtrado: Columna 5 es un codigo 5xx\n    $5 ~ /^5[0-9]{2}$/ {\n        error_count[$5]++\n        total_errors++\n        total_latency += $6\n    }\n    END {\n        printf(\"\\n--- RESUMEN DE PROCESAMIENTO (STREAMING) ---\\n\")\n        printf(\"Total errores 5xx detectados: %d\\n\", total_errors)\n        if (total_errors > 0) {\n            printf(\"Latencia promedio en errores: %.2f ms\\n\", total_latency / total_errors)\n            printf(\"Desglose por codigo:\\n\")\n            for (code in error_count) {\n                printf(\"  HTTP %s: %d errores\\n\", code, error_count[code])\n            }\n        }\n    }\n'\n",
  "codeLanguage": "bash",
  "expectedOutput": "Iniciando procesamiento por streaming sin almacenamiento intermedio en disco...\n\n--- RESUMEN DE PROCESAMIENTO (STREAMING) ---\nTotal errores 5xx detectados: 166700\nLatencia promedio en errores: 427.50 ms\nDesglose por codigo:\n  HTTP 500: 55566 errores\n  HTTP 502: 55567 errores\n  HTTP 503: 55567 errores",
  "verify": "El script procesa medio millón de registros en pocos segundos manteniendo una huella de memoria virtual insignificante (<10MB) gracias al mecanismo de streaming continuo de tuberías Unix.",
  "successCriteria": [
    "No se crea ningún archivo temporal en el disco durante el procesamiento.",
    "El comando awk filtra correctamente los códigos de estado HTTP 5xx mediante expresiones regulares.",
    "El cálculo de latencia media y conteos por código se ejecuta de forma exacta en el bloque END.",
    "El consumo de memoria RAM se mantiene estrictamente constante en O(1)."
  ]
}
