{
  "$schema": "../../../../schemas/lab.schema.json",
  "id": "terraform-docker-cicd-pipeline",
  "title": "Infraestructura Declarativa con Terraform y CI/CD en GitHub Actions",
  "goal": "Escribir la configuración declarativa de Terraform para aprovisionar un bucket de almacenamiento seguro (S3/MinIO) con cifrado y control de versiones, y construir un flujo de trabajo de GitHub Actions para validar la sintaxis de DAGs y el formateo SQL con linters estáticos.",
  "level": "intermediate",
  "estimatedMinutes": 45,
  "icon": "git",
  "domainId": "orchestration-quality-dataops",
  "lessonId": "iac-terraform-cicd",
  "file": "main.tf",
  "steps": [
    "Escribir main.tf configurando el proveedor AWS / MinIO y la declaración de un bucket de almacenamiento 'lakehouse-bronze' con versionado habilitado.",
    "Añadir la regla de bloqueo estricto de acceso público (aws_s3_bucket_public_access_block).",
    "Declarar una política IAM que otorgue acceso exclusivo de lectura/escritura únicamente a la identidad del rol de Airflow.",
    "Crear el archivo de GitHub Actions .github/workflows/dataops_lint.yml con pasos para instalar dependencias, validar sintaxis de DAGs de Airflow y ejecutar sqlfluff sobre scripts SQL.",
    "Verificar que el plan de Terraform (terraform plan) y el linter de CI se ejecutan con éxito."
  ],
  "code": "# 1. Archivo de Infraestructura como Codigo (main.tf)\n\"\"\"\nterraform {\n  required_version = \">= 1.8.0\"\n  required_providers {\n    aws = {\n      source  = \"hashicorp/aws\"\n      version = \"~> 5.0\"\n    }\n  }\n}\n\nprovider \"aws\" {\n  region = \"us-east-1\"\n}\n\n# Bucket para Lakehouse Bronze\nresource \"aws_s3_bucket\" \"lakehouse_bronze\" {\n  bucket        = \"company-dataops-lakehouse-bronze\"\n  force_destroy = false\n\n  tags = {\n    Environment = \"Production\"\n    ManagedBy   = \"Terraform\"\n    Domain      = \"DataEngineering\"\n  }\n}\n\n# Bloqueo total de acceso publico (Regla de seguridad innegociable)\nresource \"aws_s3_bucket_public_access_block\" \"public_block\" {\n  bucket = aws_s3_bucket.lakehouse_bronze.id\n\n  block_public_acls       = true\n  block_public_policy     = true\n  ignore_public_acls      = true\n  restrict_public_buckets = true\n}\n\n# Versionado habilitado para auditoria y recuperacion ante desastres\nresource \"aws_s3_bucket_versioning\" \"versioning\" {\n  bucket = aws_s3_bucket.lakehouse_bronze.id\n  versioning_configuration {\n    status = \"Enabled\"\n  }\n}\n\"\"\"\n\n# 2. Pipeline de CI/CD (.github/workflows/ci.yml)\n\"\"\"\nname: DataOps CI Pipeline\non: [pull_request]\n\njobs:\n  lint-and-validate:\n    runs-on: ubuntu-latest\n    steps:\n      - uses: actions/checkout@v4\n      \n      - name: Set up Python\n        uses: actions/setup-python@v5\n        with:\n          python-version: '3.11'\n          \n      - name: Install Linters\n        run: |\n          pip install ruff sqlfluff apache-airflow\n          \n      - name: Lint Python Code with Ruff\n        run: ruff check dags/ etl/\n        \n      - name: Validate Airflow DAG Syntax\n        run: python -m compileall dags/\n        \n      - name: Lint SQL files with SQLFluff\n        run: sqlfluff lint sql/ --dialect postgres\n\"\"\"\n",
  "codeLanguage": "terraform",
  "expectedOutput": "Terraform will perform the following actions:\n  + resource \"aws_s3_bucket\" \"lakehouse_bronze\"\n  + resource \"aws_s3_bucket_public_access_block\" \"public_block\"\n  + resource \"aws_s3_bucket_versioning\" \"versioning\"\n\nPlan: 3 to add, 0 to change, 0 to destroy.\n\nAll checks in CI Workflow passed: 0 errors detected.",
  "verify": "La declaración de Terraform provisiona un bucket inmutable con bloqueo público estricto y el workflow de GitHub Actions automatiza el control de calidad estática antes de cualquier despliegue.",
  "successCriteria": [
    "Terraform declara el bucket con bloqueo público y versionado habilitados.",
    "El flujo de GitHub Actions incluye chequeo de sintaxis de Airflow mediante compileall.",
    "SQLFluff se configura con el dialecto adecuado para validar el formateo de SQL.",
    "El pipeline falla si se introduce código espagueti o un DAG con dependencias circulares."
  ]
}
