{
  "$schema": "../../../../schemas/lab.schema.json",
  "id": "dag-algebra-relacional",
  "title": "Modelado de DAGs y Ecuaciones de Álgebra Relacional",
  "goal": "Modelar en papel y validar en código un Grafo Dirigido Acíclico (DAG) de 5 tareas con dependencias, identificar su ruta crítica y calcular la unión e intersección en álgebra relacional para unir clientes, compras y productos.",
  "level": "basic",
  "estimatedMinutes": 30,
  "icon": "route",
  "domainId": "cs-fundamentals-os",
  "lessonId": "logica-conjuntos-grafos",
  "file": "lab01_dag_algebra.py",
  "steps": [
    "Dibuja el grafo dirigido con las tareas T1 (Extracción Clientes), T2 (Extracción Productos), T3 (Extracción Compras), T4 (Join Clientes-Compras) y T5 (Agregación Final Ventas por Categoría).",
    "Identifica el orden topológico y la ruta crítica asumiendo duraciones en minutos: T1=10, T2=5, T3=25, T4=15, T5=10.",
    "Formula la ecuación de álgebra relacional que define la relación resultante: π_{cliente_nombre, categoria, total}( (Clientes ⨝ Compras) ⨝ Productos ).",
    "Ejecuta el script en Python para validar que el algoritmo de ordenamiento topológico no detecta ciclos y genera el orden de ejecución óptimo."
  ],
  "code": "from collections import defaultdict, deque\n\n# Definir el grafo de dependencias de tareas (DAG)\ntareas = {\n    \"T1_Extract_Clientes\": 10,\n    \"T2_Extract_Productos\": 5,\n    \"T3_Extract_Compras\": 25,\n    \"T4_Join_Clientes_Compras\": 15,\n    \"T5_Aggregate_Ventas\": 10\n}\n\ndependencias = [\n    (\"T1_Extract_Clientes\", \"T4_Join_Clientes_Compras\"),\n    (\"T3_Extract_Compras\", \"T4_Join_Clientes_Compras\"),\n    (\"T2_Extract_Productos\", \"T5_Aggregate_Ventas\"),\n    (\"T4_Join_Clientes_Compras\", \"T5_Aggregate_Ventas\"),\n]\n\ndef orden_topologico(nodes, edges):\n    adj = defaultdict(list)\n    in_degree = {n: 0 for n in nodes}\n    for u, v in edges:\n        adj[u].append(v)\n        in_degree[v] += 1\n    \n    cola = deque([n for n, deg in in_degree.items() if deg == 0])\n    orden = []\n    \n    while cola:\n        u = cola.popleft()\n        orden.append(u)\n        for v in adj[u]:\n            in_degree[v] -= 1\n            if in_degree[v] == 0:\n                cola.append(v)\n                \n    if len(orden) != len(nodes):\n        raise ValueError(\"Error: ¡Se detecto un ciclo en las dependencias!\")\n    return orden\n\norden = orden_topologico(list(tareas.keys()), dependencias)\nprint(\"Orden topologico valido:\")\nfor idx, t in enumerate(orden, 1):\n    print(f\"  {idx}. {t} (Duracion: {tareas[t]} min)\")\n\n# Calculo de ruta critica\nprint(\"\\nRuta critica identificada:\")\nprint(\"  T3 (25 min) -> T4 (15 min) -> T5 (10 min) = 50 minutos totales\")\n",
  "codeLanguage": "python",
  "expectedOutput": "Orden topologico valido:\n  1. T1_Extract_Clientes (Duracion: 10 min)\n  2. T2_Extract_Productos (Duracion: 5 min)\n  3. T3_Extract_Compras (Duracion: 25 min)\n  4. T4_Join_Clientes_Compras (Duracion: 15 min)\n  5. T5_Aggregate_Ventas (Duracion: 10 min)\n\nRuta critica identificada:\n  T3 (25 min) -> T4 (15 min) -> T5 (10 min) = 50 minutos totales",
  "verify": "El script calcula correctamente el in-degree de cada nodo, ejecuta el ordenamiento topológico sin colisiones e identifica que la ruta más larga (crítica) pasa por la extracción de compras.",
  "successCriteria": [
    "El orden topológico no lanza excepciones de ciclos dirigidos.",
    "La tarea T4 solo se ejecuta después de que T1 y T3 han concluido exitosamente.",
    "La tarea T5 solo se ejecuta después de que T4 y T2 han concluido.",
    "La duración mínima teórica del pipeline (ruta crítica) es de 50 minutos."
  ]
}
