{
  "$schema": "../../../../schemas/lab.schema.json",
  "id": "great-expectations-circuit-breaker",
  "title": "Circuit Breaker de Calidad de Datos con Contratos Estrictos",
  "goal": "Construir un validador de contratos de datos utilizando Python y Great Expectations (o validadores declarativos de esquemas) que actúe como un Circuit Breaker, verificando reglas de negocio estrictas (nulos < 1%, montos positivos y columnas obligatorias) y bloqueando el pipeline ante datos corruptos.",
  "level": "intermediate",
  "estimatedMinutes": 40,
  "icon": "shield",
  "domainId": "orchestration-quality-dataops",
  "lessonId": "calidad-datos-observabilidad",
  "file": "data_contract_circuit_breaker.py",
  "steps": [
    "Definir el contrato de datos formal: columnas requeridas ['id', 'user_id', 'amount', 'timestamp'], tipo de datos y restricciones de valor.",
    "Crear un conjunto de datos válido y simular un segundo lote corrupto (un productor upstream envía 'amount' negativo y nulos excesivos).",
    "Implementar la función de validación que aplique las reglas del contrato (expectation suite).",
    "Configurar el comportamiento de Circuit Breaker: si la validación falla, lanzar una excepción fatal con el detalle de las violaciones para abortar la tarea.",
    "Comprobar que el lote válido avanza y el lote corrupto activa el bloqueo inmediatamente."
  ],
  "code": "from typing import List, Dict, Any\nimport pandas as pd\nimport sys\n\nclass DataContractViolation(Exception):\n    \"\"\"Excepcion levantada para activar el Circuit Breaker de calidad de datos.\"\"\"\n    pass\n\ndef validate_data_contract(df: pd.DataFrame) -> bool:\n    errors = []\n    \n    # Regla 1: Columnas requeridas presentes\n    required_columns = {\"id\", \"user_id\", \"amount\", \"timestamp\"}\n    missing_cols = required_columns - set(df.columns)\n    if missing_cols:\n        errors.append(f\"Violacion de Esquema: Faltan columnas obligatorias: {missing_cols}\")\n        \n    # Regla 2: Porcentaje de nulos en user_id menor al 1%\n    if \"user_id\" in df.columns:\n        null_ratio = df[\"user_id\"].isnull().mean()\n        if null_ratio > 0.01:\n            errors.append(f\"Violacion de Calidad: Tasa de nulos en 'user_id' es {null_ratio:.2%}, excede el maximo del 1.0%\")\n            \n    # Regla 3: Montos estrictamente mayores a 0\n    if \"amount\" in df.columns:\n        negative_count = (df[\"amount\"] <= 0).sum()\n        if negative_count > 0:\n            errors.append(f\"Violacion de Integridad: Se encontraron {negative_count} registros con montos <= 0\")\n            \n    if errors:\n        print(\"\\n[CIRCUIT BREAKER ACTIVADO] Deteniendo pipeline por violaciones criticas:\")\n        for err in errors:\n            print(f\"  - {err}\")\n        raise DataContractViolation(\"El lote de datos ha sido rechazado por el contrato de calidad.\")\n        \n    print(\"[CONTRATO VALIDO] El dataset cumple con todas las expectativas de calidad.\")\n    return True\n\n# 1. Prueba con Lote Valido\nprint(\"--- EVALUANDO LOTE 1 (DATOS SALUDABLES) ---\")\ndf_healthy = pd.DataFrame([\n    {\"id\": 1, \"user_id\": 101, \"amount\": 45.0, \"timestamp\": \"2026-09-28T12:00:00\"},\n    {\"id\": 2, \"user_id\": 102, \"amount\": 120.5, \"timestamp\": \"2026-09-28T12:01:00\"},\n    {\"id\": 3, \"user_id\": 103, \"amount\": 89.9, \"timestamp\": \"2026-09-28T12:02:00\"}\n])\nvalidate_data_contract(df_healthy)\n\n# 2. Prueba con Lote Corrupto (Upstream bug)\nprint(\"\\n--- EVALUANDO LOTE 2 (DATOS CORRUPTOS UPSTREAM) ---\")\ndf_corrupted = pd.DataFrame([\n    {\"id\": 4, \"user_id\": None, \"amount\": -500.0, \"timestamp\": \"2026-09-28T12:03:00\"},\n    {\"id\": 5, \"user_id\": None, \"amount\": -10.0, \"timestamp\": \"2026-09-28T12:04:00\"}\n])\n\ntry:\n    validate_data_contract(df_corrupted)\nexcept DataContractViolation as e:\n    print(f\"\\nResultado esperado: El pipeline fue abortado con exito. ({e})\")\n",
  "codeLanguage": "python",
  "expectedOutput": "--- EVALUANDO LOTE 1 (DATOS SALUDABLES) ---\n[CONTRATO VALIDO] El dataset cumple con todas las expectativas de calidad.\n\n--- EVALUANDO LOTE 2 (DATOS CORRUPTOS UPSTREAM) ---\n\n[CIRCUIT BREAKER ACTIVADO] Deteniendo pipeline por violaciones criticas:\n  - Violacion de Calidad: Tasa de nulos en 'user_id' es 100.00%, excede el maximo del 1.0%\n  - Violacion de Integridad: Se encontraron 2 registros con montos <= 0\n\nResultado esperado: El pipeline fue abortado con exito. (El lote de datos ha sido rechazado por el contrato de calidad.)",
  "verify": "El validador detecta las violaciones de contrato y levanta una excepción DataContractViolation que detiene la tarea, evitando la contaminación de downstream.",
  "successCriteria": [
    "El lote saludable pasa la validación sin errores.",
    "El lote corrupto es interceptado antes de cualquier operación de carga a base de datos.",
    "Se reportan detalladamente las causas exactas del rechazo.",
    "La excepción generada se integra limpiamente con el sistema de reintentos y alertas de Airflow."
  ]
}
