{
  "$schema": "../../../../schemas/lab.schema.json",
  "id": "kafka-broker-rebalance-fault-tolerance",
  "title": "Apache Kafka: Consumer Groups, Rebalances y Tolerancia a Fallos",
  "goal": "Levantar un clúster local de Apache Kafka, generar un flujo concurrente de mensajes en un tópico multipartición, desplegar un Consumer Group con múltiples instancias, simular la caída abrupta de un consumidor y auditar cómo Kafka rebalancea las particiones y reanuda el consumo desde el último offset confirmado sin pérdida ni duplicación de mensajes.",
  "level": "intermediate",
  "estimatedMinutes": 45,
  "icon": "bolt",
  "domainId": "streaming-real-time",
  "lessonId": "motores-mensajeria-kafka",
  "file": "kafka_rebalance_demo.py",
  "steps": [
    "Crear un tópico de Kafka denominado banking.transactions con 4 particiones y factor de replicación 1.",
    "Lanzar un productor concurrente que publique 1,000 eventos distribuidos por hash de clave (user_id).",
    "Iniciar dos instancias de consumidores (Consumidor A y Consumidor B) pertenecientes al mismo grupo de consumo 'fraud-monitors'.",
    "Verificar que cada consumidor recibe exactamente 2 particiones asignadas por el Group Coordinator.",
    "Simular la muerte forzosa de Consumidor B (kill -9) a mitad del flujo y observar el evento de Rebalance.",
    "Comprobar que Consumidor A asume las 4 particiones y continúa leyendo desde el último commit de offset sin reprocesar mensajes previos."
  ],
  "code": "import time\nimport threading\nfrom typing import Dict, List\n\n# Simulador didactico y robusto del protocolo de Consumer Group de Kafka\nclass MockKafkaTopic:\n    def __init__(self, name: str, partitions: int = 4):\n        self.name = name\n        self.partitions_count = partitions\n        self.logs: Dict[int, List[Dict[str, str]]] = {i: [] for i in range(partitions)}\n        self.committed_offsets: Dict[str, Dict[int, int]] = {}  # group_id -> {partition: offset}\n\n    def produce(self, key: str, payload: str):\n        partition_id = hash(key) % self.partitions_count\n        offset = len(self.logs[partition_id])\n        msg = {\"key\": key, \"payload\": payload, \"offset\": offset}\n        self.logs[partition_id].append(msg)\n        return partition_id, offset\n\nclass MockConsumer:\n    def __init__(self, consumer_id: str, group_id: str, topic: MockKafkaTopic):\n        self.consumer_id = consumer_id\n        self.group_id = group_id\n        self.topic = topic\n        self.assigned_partitions = []\n        self.is_alive = True\n        self.processed_messages = []\n\n    def consume_assigned(self):\n        if self.group_id not in self.topic.committed_offsets:\n            self.topic.committed_offsets[self.group_id] = {p: 0 for p in range(self.topic.partitions_count)}\n            \n        for p in self.assigned_partitions:\n            current_offset = self.topic.committed_offsets[self.group_id].get(p, 0)\n            while current_offset < len(self.topic.logs[p]):\n                if not self.is_alive:\n                    print(f\"  [!] {self.consumer_id} MURIO ABRUPTAMENTE en particion {p}, offset {current_offset}\")\n                    return\n                msg = self.topic.logs[p][current_offset]\n                self.processed_messages.append(msg)\n                current_offset += 1\n                # Commit at-least-once del offset\n                self.topic.committed_offsets[self.group_id][p] = current_offset\n\n# Demostracion de ejecucion\ntopic = MockKafkaTopic(\"banking.transactions\", partitions=4)\nfor i in range(100):\n    topic.produce(f\"user_{i%10}\", f\"payment_amount_{i*10}\")\n\nprint(\"1. Productor: 100 mensajes distribuidos en 4 particiones.\")\n\n# Crear Consumer Group con dos miembros\nca = MockConsumer(\"Consumidor_A\", \"fraud-group\", topic)\ncb = MockConsumer(\"Consumidor_B\", \"fraud-group\", topic)\n\n# Asignacion inicial equilibrada (2 particiones cada uno)\nca.assigned_partitions = [0, 1]\ncb.assigned_partitions = [2, 3]\nprint(\"2. Asignacion inicial: Consumidor_A tiene [0,1], Consumidor_B tiene [2,3]\")\n\n# Simulamos fallo de Consumidor B tras procesar un poco\ncb.is_alive = False\ncb.consume_assigned()\nca.consume_assigned()\n\nprint(\"\\n3. DISPARANDO REBALANCE DE GRUPO: Consumidor_B ha muerto...\")\n# El Group Coordinator reasigna todas las particiones al consumidor sobreviviente\nca.assigned_partitions = [0, 1, 2, 3]\nprint(\"4. Consumidor_A asume las 4 particiones y retoma desde el offset guardado.\")\nca.consume_assigned()\n\ntotal_proc = len(ca.processed_messages) + len(cb.processed_messages)\nprint(f\"\\nTotal mensajes procesados sin perdidas tras rebalance: {total_proc}/100\")\n",
  "codeLanguage": "python",
  "expectedOutput": "1. Productor: 100 mensajes distribuidos en 4 particiones.\n2. Asignacion inicial: Consumidor_A tiene [0,1], Consumidor_B tiene [2,3]\n  [!] Consumidor_B MURIO ABRUPTAMENTE en particion 2, offset 0\n\n3. DISPARANDO REBALANCE DE GRUPO: Consumidor_B ha muerto...\n4. Consumidor_A asume las 4 particiones y retoma desde el offset guardado.\n\nTotal mensajes procesados sin perdidas tras rebalance: 100/100",
  "verify": "El simulador muestra que el protocolo de Rebalance de Kafka detecta la muerte del nodo, reasigna sus particiones al miembro vivo y reanuda el consumo sin perder mensajes gracias a la persistencia de offsets en __consumer_offsets.",
  "successCriteria": [
    "Las 4 particiones se distribuyen equitativamente entre los consumidores iniciales.",
    "La muerte del consumidor no bloquea el avance de las particiones sobrevivientes.",
    "El consumidor rebalanceado lee desde el offset comprometido sin recomenzar desde el inicio.",
    "El conteo total de eventos procesados es exactamente 100% de los mensajes producidos."
  ]
}
