{
  "$schema": "../../../../schemas/lab.schema.json",
  "id": "lab-spark-narrow-wide-shuffle",
  "title": "Inspección de Planes de Ejecución y Coste de Shuffle con PySpark",
  "goal": "Utilizar explain() y analizar las etapas de un plan físico para identificar transformaciones Narrow vs Wide y cuantificar el coste de un Shuffle.",
  "level": "intermediate",
  "estimatedMinutes": 15,
  "icon": "terminal",
  "domainId": "spark-distributed-computing",
  "lessonId": "narrow-vs-wide-transformations-shuffle",
  "file": "lab01_spark_shuffle.py",
  "steps": [
    "Inicializa una sesión de Spark local configurando 200 particiones de shuffle.",
    "Crea un DataFrame sintético y aplica transformaciones Narrow (filter, withColumn).",
    "Aplica una transformación Wide (groupBy con count) e imprime el plan físico con explain().",
    "Identifica el operador 'Exchange hashpartitioning' que delimita la frontera del Shuffle."
  ],
  "code": "from pyspark.sql import SparkSession\nfrom pyspark.sql.functions import col\n\nspark = SparkSession.builder \\\n    .appName('LabShuffleInspection') \\\n    .master('local[*]') \\\n    .config('spark.sql.shuffle.partitions', '4') \\\n    .getOrCreate()\n\ndata = [(i, f'user_{i % 100}', i * 1.5) for i in range(100_000)]\ndf = spark.createDataFrame(data, ['id', 'user_id', 'monto'])\n\n# Narrow\nnarrow_df = df.filter(col('monto') > 50).withColumn('monto_iva', col('monto') * 1.16)\n\n# Wide\nwide_df = narrow_df.groupBy('user_id').sum('monto_iva')\n\nprint('=== PLAN FÍSICO ===')\nwide_df.explain(True)\nspark.stop()\n",
  "codeLanguage": "python",
  "expectedOutput": "HashAggregate(keys=[user_id#...], ...)\n+- Exchange hashpartitioning(user_id#..., 4)\n   +- HashAggregate(keys=[user_id#...], ...)",
  "verify": "El plan físico muestra explícitamente el operador 'Exchange' indicando el límite de la etapa donde ocurre el Shuffle de red.",
  "successCriteria": [
    "El script se ejecuta y produce el plan de ejecución lógico y físico.",
    "Se detecta el nodo Exchange hashpartitioning en la salida del optimizador."
  ]
}