{
  "$schema": "../../../../schemas/lab.schema.json",
  "id": "lab-api-backoff-jitter-extractor",
  "title": "Extractor HTTP Resiliente con Backoff y Jitter",
  "goal": "Simular un servidor HTTP que emite errores 429 transitorios y programar un cliente resiliente con reintentos exponenciales y jitter aleatorio.",
  "level": "intermediate",
  "estimatedMinutes": 15,
  "icon": "clock",
  "domainId": "ingestion-storage-formats",
  "lessonId": "extraccion-resiliente-backoff-cursores",
  "file": "lab03_resilient_extractor.py",
  "steps": [
    "Simula llamadas a una API con probabilidad de fallo de tasa 429 en los primeros 2 intentos.",
    "Implementa el cálculo de retardo exponencial con función aleatoria de Jitter.",
    "Verifica que la petición se recupera con éxito en el tercer intento."
  ],
  "code": "import time, random\n\nclass APIMock:\n    def __init__(self):\n        self.intentos = 0\n    def fetch(self):\n        self.intentos += 1\n        if self.intentos < 3:\n            return 429, None\n        return 200, {'data': 'lote_completado', 'cursor': 'next_xyz'}\n\napi = APIMock()\nbase_delay = 0.1\n\nfor attempt in range(5):\n    status, payload = api.fetch()\n    if status == 200:\n        print(f'Exito en intento {attempt+1}: {payload}')\n        break\n    elif status == 429:\n        sleep_t = (base_delay * (2 ** attempt)) + random.uniform(0.01, 0.05)\n        print(f'Intento {attempt+1} fallido (429). Esperando {sleep_t:.3f}s...')\n        time.sleep(sleep_t)\n",
  "codeLanguage": "python",
  "expectedOutput": "Intento 1 fallido (429). Esperando 0.134s...\nIntento 2 fallido (429). Esperando 0.221s...\nExito en intento 3: {'data': 'lote_completado', 'cursor': 'next_xyz'}",
  "verify": "El algoritmo incrementa el tiempo de espera en cada fallo y recupera la respuesta con éxito.",
  "successCriteria": [
    "Se implementa backoff exponencial con adición de jitter aleatorio.",
    "El cliente no cae en bucles infinitos y reporta el éxito de la extracción."
  ]
}