{
  "$schema": "../../../../schemas/lab.schema.json",
  "id": "window-functions-cohort-retention",
  "title": "SQL Analítico: Cohortes y Deltas con Funciones de Ventana",
  "goal": "Escribir consultas analíticas avanzadas en PostgreSQL utilizando CTEs y funciones de ventana (LAG, SUM OVER, FIRST_VALUE) para calcular la retención mensual de usuarios y la variación porcentual (delta) de ingresos sin descargar datos a memoria externa.",
  "level": "intermediate",
  "estimatedMinutes": 40,
  "icon": "chart",
  "domainId": "relational-modeling-olap",
  "lessonId": "sql-analitico-funciones-ventana",
  "file": "analytical_queries.sql",
  "steps": [
    "Crear una tabla de pedidos (orders) con user_id, order_date, amount.",
    "Insertar datos de compras distribuidas en múltiples meses.",
    "Escribir una consulta usando LAG() para calcular los ingresos mensuales y el delta de ventas respecto al mes inmediatamente anterior.",
    "Construir un análisis de cohortes identificando el mes de primera compra de cada usuario usando FIRST_VALUE() o MIN() OVER (PARTITION BY user_id).",
    "Calcular el porcentaje de usuarios retenidos en los meses subsiguientes."
  ],
  "code": "-- 1. Estructura de ventas\nDROP TABLE IF EXISTS orders;\nCREATE TABLE orders (\n    order_id SERIAL PRIMARY KEY,\n    user_id INT NOT NULL,\n    order_date DATE NOT NULL,\n    amount NUMERIC(10,2) NOT NULL\n);\n\nINSERT INTO orders (user_id, order_date, amount) VALUES\n(1, '2026-01-10', 100.00), (2, '2026-01-15', 50.00),\n(1, '2026-02-12', 120.00), (3, '2026-02-20', 80.00),\n(2, '2026-03-05', 75.00),  (3, '2026-03-18', 90.00), (1, '2026-03-25', 110.00);\n\n-- 2. Calculo de Ventas Mensuales y Delta porcentual con LAG()\nWITH monthly_sales AS (\n    SELECT \n        date_trunc('month', order_date)::DATE AS sales_month,\n        sum(amount) AS total_revenue\n    FROM orders\n    GROUP BY 1\n)\nSELECT \n    sales_month,\n    total_revenue,\n    LAG(total_revenue, 1) OVER (ORDER BY sales_month) AS prev_month_revenue,\n    ROUND(\n        ((total_revenue - LAG(total_revenue, 1) OVER (ORDER BY sales_month)) / \n         LAG(total_revenue, 1) OVER (ORDER BY sales_month)) * 100, 2\n    ) AS delta_percentage\nFROM monthly_sales;\n\n-- 3. Analisis de Cohortes con funciones analiticas\nWITH user_cohorts AS (\n    SELECT \n        user_id,\n        order_date,\n        MIN(date_trunc('month', order_date)::DATE) OVER (PARTITION BY user_id) AS cohort_month,\n        date_trunc('month', order_date)::DATE AS activity_month\n    FROM orders\n)\nSELECT \n    cohort_month,\n    activity_month,\n    COUNT(DISTINCT user_id) AS active_users\nFROM user_cohorts\nGROUP BY cohort_month, activity_month\nORDER BY cohort_month, activity_month;\n",
  "codeLanguage": "sql",
  "expectedOutput": "sales_month | total_revenue | prev_month_revenue | delta_percentage\n------------+---------------+--------------------+------------------\n2026-01-01  |        150.00 |               NULL |             NULL\n2026-02-01  |        200.00 |             150.00 |            33.33\n2026-03-01  |        275.00 |             200.00 |            37.50",
  "verify": "La consulta CTE con función de ventana LAG() calcula con precisión matemática el crecimiento intermensual y la agrupación por cohortes refleja la recurrencia de usuarios sin pérdida de filas.",
  "successCriteria": [
    "La función LAG() recupera correctamente el valor del mes anterior sin requerir un autoreferencial SELF-JOIN costoso.",
    "El cálculo del delta porcentual maneja correctamente el valor inicial nulo.",
    "La consulta de cohortes identifica la fecha de adquisición original por usuario.",
    "Toda la analítica se delega 100% al motor SQL sin usar scripts externos."
  ]
}
